{
  "$schema": "http://json-schema.org/draft-04/schema#",

  "title": "Categories List",
  "type": "object",

  "required": ["offset", "count", "total", "results"],

  "properties": {
    "offset": {
      "$ref": "schemas/offset.schema.json"
    },
    "count": {
      "$ref": "schemas/count.schema.json"
    },
    "total": {
      "$ref": "schemas/total.schema.json"
    },
    "results": {
      "type": "array",
      "items": {
        "$ref": "schemas/category.schema.json"
      }
    }
  }
}
