{
  "offset": 0,
  "count": 2,
  "total": 2,
  "results": [
    {
      "id": "f584ebbb-3805-43f3-80c8-76f98b2c18b5",
      "version": 5,
      "container": "channel",
      "key": "ac390383-370f-43f8-a534-db1604cb96a8",
      "value": "{\"name\":\"Commercetools\",\"slug\":\"commercetools\",\"lat\":52.523753,\"lng\":13.380434}",
      "createdAt": "2015-05-28T09:48:35.098Z",
      "lastModifiedAt": "2015-07-01T15:58:36.930Z"
    },
    {
      "id": "d8523d32-a79d-441c-90f4-744cc342126e",
      "version": 2,
      "container": "test-container",
      "key": "test-key",
      "value": "test-value",
      "createdAt": "2016-02-18T10:36:29.468Z",
      "lastModifiedAt": "2016-02-18T10:36:29.571Z"
    }
  ]
}
