{
  "offset": 0,
  "count": 2,
  "total": 2,
  "results": [
    {
      "id": "7c2e2694-aefe-43d7-888e-6a99514caaca",
      "version": 1,
      "key": "Initial",
      "type": "LineItemState",
      "roles": [],
      "name": {
        "en": "Initial"
      },
      "description": {
        "en": "Initial is the first that (custom) line item gets after it's creation"
      },
      "builtIn": true,
      "initial": true,
      "createdAt": "2015-01-21T09:22:03.906Z",
      "lastModifiedAt": "2015-01-21T09:22:03.906Z"
    },
    {
      "id": "fb2b1abd-7598-40f1-906c-9e5e7c6f8ebc",
      "version": 1,
      "key": "test-state",
      "type": "ProductState",
      "roles": [],
      "builtIn": false,
      "initial": true,
      "createdAt": "2016-02-18T17:18:53.338Z",
      "lastModifiedAt": "2016-02-18T17:18:53.338Z"
    }
  ]
}
