{
  "count": 3,
  "offset": 0,
  "total": 110,
  "results": [
    {
      "imageUrl": "http://cdn6.bigcommerce.com/s-stm8v/products/586/images/1711/3D_GOLF_HOODIE_BLACK__17630.1481286168.490.588.jpg?c=2",
      "productVariants": [
        {
          "product": {
            "id": "0f5feac3-b50f-447b-8c36-7603153a2dd0",
            "typeId": "product"
          },
          "staged": true,
          "variantId": 1
        }
      ]
    },
    {
      "imageUrl": "http://images.koovscdn.com/uploads/products/81364_1a41bcd8e5e3a8bf675c48aa2be132a3_image1_zoom.jpg",
      "productVariants": [
        {
          "product": {
            "id": "8a7f5101-8b20-4ba6-8988-ff43dbf35d3d",
            "typeId": "product"
          },
          "staged": true,
          "variantId": 1
        }
      ]
    },
    {
      "imageUrl": "http://sandiegobrewing.com/gear/wp-content/uploads/2015/03/guy-white-380x380.png",
      "productVariants": [
        {
          "product": {
            "id": "15245f8f-478b-426a-b3a9-41e8257f39d9",
            "typeId": "product"
          },
          "staged": true,
          "variantId": 1
        },
        {
          "product": {
            "id": "a315869c-3d78-476c-99d1-3dec4375a97a",
            "typeId": "product"
          },
          "staged": false,
          "variantId": 1
        },
        {
          "product": {
            "id": "a315869c-3d78-476c-99d1-3dec4375a97a",
            "typeId": "product"
          },
          "staged": true,
          "variantId": 1
        }
      ]
    }
  ]
}
